{
  "id": "password-change",
  "source": {"kind": "synthetic"},
  "expected": {"roles": {"c": "CurrentPassword", "n": "NewPassword", "x": "ConfirmPassword"}},
  "fields": [
    {"id": "c", "inputType": "password", "autofillHints": ["password"], "htmlType": null, "name": "current_password", "focused": true},
    {"id": "n", "inputType": "password", "autofillHints": ["newPassword"], "htmlType": null, "name": "new_password", "focused": false},
    {"id": "x", "inputType": "password", "autofillHints": ["newPassword"], "htmlType": null, "name": "confirm_password", "focused": false}
  ]
}
