{
  "id": "email-password",
  "source": {"kind": "synthetic"},
  "expected": {"roles": {"e": "Email", "p": "CurrentPassword"}},
  "fields": [
    {"id": "e", "inputType": "email", "autofillHints": ["emailAddress"], "htmlType": null, "name": "email", "focused": true},
    {"id": "p", "inputType": "password", "autofillHints": ["password"], "htmlType": null, "name": "password", "focused": false}
  ]
}
