{
  "id": "classic-username-password",
  "source": {"kind": "synthetic"},
  "expected": {"roles": {"u": "Username", "p": "CurrentPassword"}},
  "fields": [
    {"id": "u", "inputType": "text", "autofillHints": ["username"], "htmlType": null, "name": "username", "focused": true},
    {"id": "p", "inputType": "password", "autofillHints": ["password"], "htmlType": null, "name": "password", "focused": false}
  ]
}
